{
  "schema_version": "gatelm.routing-difficulty-dataset-manifest.v1",
  "dataset_version": "routing_difficulty_initial_15000_gpt_b_c_revised_2026_07_21",
  "record_schema_version": "gatelm.routing-difficulty-dataset-record.v1",
  "record_schema_path": "docs/routing/datasets/difficulty/schemas/difficulty-dataset-record.schema.json",
  "dataset_path": "docs/routing/datasets/difficulty/data/initial-routing-difficulty-15000.reviewer-b-c-revised.jsonl",
  "dataset_sha256": "1236c01e8f2454cf926b2b9573f8f44e3c73ee2750c95642cce49ce5d3b5028c",
  "generated_at": "2026-07-21T00:00:00Z",
  "generation_seed": 20260721,
  "scope": {
    "initial_target_records": 15000,
    "generated_records": 15000,
    "deferred_public_records": 0,
    "public_records": 7000,
    "training_eligible": false,
    "training_blockers": [
      "same_family_llm_labels_not_independent_or_human_reviewed",
      "independent_reviewer_a_not_completed",
      "human_adjudication_not_completed",
      "direct_human_authored_share_below_60_percent",
      "anonymous_real_user_source_unavailable_without_additional_approval",
      "semantic_embedding_duplicate_candidates_remain_for_revised_labels"
    ]
  },
  "counts": {
    "records": 15000,
    "groups": 8752,
    "public_records": 7000,
    "synthetic_records": 6000,
    "boundary_records": 2000,
    "human_reviewed_records": 0,
    "public_human_origin_records": 6873,
    "public_direct_human_authored_records": 2674,
    "public_real_user_records": 0
  },
  "distributions": {
    "label": {
      "complex": 5271,
      "simple": 9729
    },
    "language": {
      "en": 2250,
      "ko": 12000,
      "mixed": 750
    },
    "source": {
      "boundary": 2000,
      "public": 7000,
      "synthetic": 6000
    },
    "source_dataset": {
      "aya_dataset": 387,
      "databricks_dolly_15k": 607,
      "haerae_bench_2": 127,
      "hrm8k_ksm": 979,
      "k2_eval": 55,
      "kite": 154,
      "klue_mrc": 142,
      "kullm_v2_dolly": 3100,
      "openassistant_oasst1": 1449
    },
    "split": {
      "test": 2250,
      "train": 10500,
      "validation": 2250
    },
    "task_type": {
      "business_report": 444,
      "code_explanation": 465,
      "code_generation": 900,
      "code_modification": 438,
      "code_review": 429,
      "comparison_evaluation": 824,
      "data_analysis": 606,
      "debugging": 545,
      "document_writing": 900,
      "fact_explanation": 900,
      "file_processing": 470,
      "general_query": 900,
      "internal_document_query": 471,
      "json_conversion": 477,
      "math_problem": 900,
      "multi_document_comparison": 424,
      "planning": 900,
      "rag_query": 435,
      "search": 580,
      "structured_data_processing": 900,
      "summarization": 642,
      "table_conversion": 900,
      "translation": 550
    },
    "service_domain": {
      "business_format_conversion": 786,
      "business_reporting": 724,
      "business_strategy": 865,
      "compliance": 402,
      "corporate_operations": 400,
      "customer_support": 662,
      "data_analysis": 1046,
      "document_management": 553,
      "finance_accounting": 562,
      "hr_recruiting": 565,
      "internal_policy": 492,
      "legal": 485,
      "marketing": 632,
      "meeting_minutes": 544,
      "privacy": 404,
      "product_planning": 840,
      "project_management": 665,
      "rag_internal_knowledge": 363,
      "research": 1609,
      "sales": 591,
      "security": 576,
      "software_development": 586,
      "training_onboarding": 648
    },
    "length_bucket": {
      "long": 1720,
      "medium": 6254,
      "short": 7026
    },
    "source_prompt_kind": {
      "benchmark_instruction": 154,
      "benchmark_question": 269,
      "employee_authored_instruction": 607,
      "handwritten_benchmark_instruction": 55,
      "human_authored_instruction": 387,
      "human_authored_prompter": 1449,
      "human_reviewed_math_question": 979,
      "machine_translated_human_instruction": 3100
    },
    "source_transform": {
      "as_published_field": 3604,
      "machine_translated_published_field": 3100,
      "prompt_serialization": 296
    },
    "automatic_label": {
      "complex": 7500,
      "simple": 7500
    },
    "label_source": {
      "llm_same_family_consensus_candidate": 3215,
      "public_rule_candidate": 3785,
      "synthetic_design": 8000
    },
    "review_status": {
      "needs_adjudication": 2249,
      "pending": 12751
    }
  },
  "coverage": {
    "task_types_present": 23,
    "service_domains_present": 23,
    "every_language_has_both_labels": true,
    "language_ratio": "80:15:5",
    "label_ratio": "9729:5271",
    "klue_length_label_proxy_control": true,
    "klue_records": 142,
    "klue_label_distribution": {
      "complex": 1,
      "simple": 141
    },
    "klue_length_only_roc_auc": 0.8652482269503546,
    "public_human_origin_share": 0.9818571428571429,
    "public_direct_human_authored_share": 0.382,
    "public_real_user_share": 0,
    "direct_human_authored_gap_records": 1526,
    "length_label_distribution": {
      "short": {
        "complex": 1376,
        "simple": 5650
      },
      "medium": {
        "complex": 3095,
        "simple": 3159
      },
      "long": {
        "complex": 800,
        "simple": 920
      }
    },
    "length_only_roc_auc": 0.6517110371001006,
    "long_records": 1720,
    "long_simple_records": 860,
    "long_complex_records": 860,
    "task_type_min_records": 424,
    "task_type_max_records": 900,
    "task_type_max_share": 0.06,
    "task_type_enforced_range": "400..900",
    "task_type_strict_400_to_900_target_met": true,
    "service_domain_min_records": 363,
    "service_domain_max_records": 1609,
    "service_domain_max_share": 0.10726666666666666,
    "service_domain_enforced_range": "300..1875",
    "service_domain_strict_12_5_percent_cap_met": true,
    "public_top_five_task_records": 3806,
    "public_top_five_task_share": 0.5437142857142857,
    "public_top_five_task_strict_55_percent_met": true,
    "every_task_type_label_share_between_35_and_65_percent": false,
    "every_service_domain_label_share_between_35_and_65_percent": false,
    "semantic_embedding_dedup_audit_path": "docs/routing/datasets/difficulty/data/initial-routing-difficulty-15000.reviewer-b-c-revised.semantic-dedup.json",
    "semantic_embedding_dedup_threshold": 0.985,
    "semantic_embedding_dedup_verified": false,
    "automatic_label_ratio": "7500:7500",
    "current_label_distribution_by_language": {
      "en": {
        "simple": 1988,
        "complex": 262
      },
      "ko": {
        "simple": 7095,
        "complex": 4905
      },
      "mixed": {
        "simple": 646,
        "complex": 104
      }
    },
    "reviewer_b_c_same_family_label_overrides": 3215,
    "reviewer_b_c_high_confidence_consensus_overrides": 1401,
    "reviewer_b_c_human_adjudication_queue_records_in_dataset": 2249,
    "independent_reviewer_a_complete": false,
    "base_prompt_projection_sha256": "7490e1c49fd1c61257adea644e7c4af90d2446f85dc53b2f4750a645afe0dd4e",
    "revised_prompt_projection_sha256": "7490e1c49fd1c61257adea644e7c4af90d2446f85dc53b2f4750a645afe0dd4e"
  },
  "deduplication": {
    "exact_duplicate_records": 0,
    "normalized_duplicate_records": 0,
    "group_split_leaks": 0,
    "public_candidates_compared_against_enterprise_8000": true,
    "semantic_duplicate_candidate_pairs": 7,
    "semantic_duplicate_method": "pinned multilingual-E5 native 384D cosine plus same-label/task/domain candidate policy on revised labels",
    "semantic_duplicate_threshold": 0.985
  },
  "review": {
    "label_source_distribution": {
      "llm_same_family_consensus_candidate": 3215,
      "public_rule_candidate": 3785,
      "synthetic_design": 8000
    },
    "review_status_distribution": {
      "needs_adjudication": 2249,
      "pending": 12751
    },
    "reviewer_b_c_same_family_label_overrides": 3215,
    "reviewer_b_c_high_confidence_consensus_overrides": 1401,
    "human_adjudication_queue_records": 2249,
    "independent_reviewer_a_complete": false,
    "human_reviewed": false,
    "production_gold": false
  },
  "components": [
    {
      "dataset_version": "routing_difficulty_enterprise_synthetic_8000_gpt_b_c_review_status_2026_07_21",
      "dataset_path": "docs/routing/datasets/difficulty/data/enterprise-synthetic-8000.reviewer-b-c-revised.jsonl",
      "records": 8000,
      "sha256": "a8415911aab3162ec0d1f942cabc04ab325e1abecd6d2ef1eb59091e55ffd376"
    },
    {
      "dataset_version": "routing_difficulty_public_prompts_7000_gpt_b_c_revised_2026_07_21",
      "dataset_path": "docs/routing/datasets/difficulty/data/public-prompts-7000.reviewer-b-c-revised.jsonl",
      "records": 7000,
      "sha256": "2c4a15b2501c2e0ba3ea99329d01fa538a1c1e4eb0a735f7a38442b2d7e8de5d"
    }
  ]
}
